persona,source_type,tier,title,org,author,date,url,summary,excerpt,priority_axis,stance_signal,collector,verified,note
한전,언론기사,t3,"한전, 2026년 1분기 전기요금 동결",인사이트에너지뉴스,김병욱,2025-12-22,https://www.inenews.kr/news/articleView.html?idxno=28058,"한전이 2026년 1분기 연료비조정단가를 kWh당 +5원으로 유지해 동결을 결정했다. 정부는 한전의 재무 상황과 연료비 조정요금 미조정액이 상당한 점을 고려해 2025년 4분기와 동일 단가를 통보했고, 경영 정상화를 위한 자구노력의 철저한 이행도 함께 요구했다.",2026년 1분기 연료비조정단가는 한전의 재무 상황과 연료비 조정요금 미조정액이 상당한 점 등을 고려해 2025년 4분기와 동일하게 +5.0원/kWh을 계속 적용 / 한전의 경영 정상화를 위한 자구노력도 철저히 이행해 달라고 통보받았다,요금 정상화,중립,자동수집(Claude),Y,
한전,언론기사,t3,"'지연·허수 발전사업' 뿌리 뽑는다…한전, 전력망 이용규정 개정",아시아경제,강나훔,2026-07-19,https://www.asiae.co.kr/article/2026071913185271356,한전이 '송·배전용전기설비 이용규정'을 개정해 발전사업 허가 후 1년 내 이용신청·계약이 없으면 접속용량을 회수하도록 했다. 그동안 관리 사각지대였던 약 30GW 규모 발전사업을 체계적으로 관리해 실수요자에게 계통 접속용량을 적기 배분하려는 조치다.,"발전사업 허가를 받은 뒤 1년 이내 전력망 이용을 신청하지 않거나, 이용 신청 후 1년 안에 이용계약을 체결하지 않으면 전력망 접속용량을 회수할 수 있도록 했다.",계통투자 재원,우호,자동수집(Claude),Y,
한전,언론기사,t3,8년간 이어진 송전선로 갈등 해소…당진시–한전 상생협력 재개,파이낸셜뉴스,김태완,2025-12-19,https://www.fnnews.com/ampNews/202512190944577323,2018년 송전선로 지중화 공사 중 발생한 부곡공단 지반침하 피해로 8년간 이어진 당진시–한전 갈등이 국민권익위 조정과 25차례 협의를 거쳐 해소됐다. 한전은 특별지원사업비를 지급하고 당진시는 중단됐던 전력사업 인허가 심의를 재개하며 '에너지 고속도로' 사업에 협력하기로 했다.,양 기관은 갈등의 직접적 원인이 됐던 2018년 송전선로 지중화 공사 중 발생한 부곡공단 지반침하 피해에 대해서도 성실히 보상 절차에 임하기로 했다,계통투자 재원,우호,자동수집(Claude),Y,
한전,언론기사,t3,"한전, 무안~신안 송전망 준공…전남 재생에너지 출력제어 완화 기대",더쎈뉴스(The CEN News),이명신,2026-06-08,https://www.mhns.co.kr/news/articleView.html?idxno=749553,한전이 총연장 52km의 154kV 무안~신안 송전망을 2026년 5월 30일 최종 준공했다. 이를 통해 약 190MW 규모의 재생에너지 접속 대기 물량 해소와 전남지역 출력제어 완화가 기대된다.,"154kV 송전망(운남신안읍동 간, 총연장 52km)을 지난 5월 30일 최종 준공했다",계통투자 재원,우호,자동수집(Claude),Y,
한전,언론기사,t3,동해안~동서울 HVDC…동서울변환소 인허가만 남아,에너지타임즈,김진철,2025-05-12,https://www.energytimes.kr/news/articleView.html?idxno=66950,한전은 동해안~동서울 HVDC가 통과하는 경북·강원·경기 79개 마을 전 구간 주민 합의 100%를 완료했다고 2025년 5월 12일 밝혔다. 그러나 하남시가 동서울변환소 변환설비 증설 인허가를 주민 수용성 부족을 이유로 미루면서 사업 지연 우려가 남아 있다.,한국전력공사(사장 김동철)는 동해안~동서울 HVDC 송전선로가 통과하는 경북‧강원‧경기 79개 마을 모든 구간에서 주민 합의 100%를 완료했다고 12일 밝혔다.,계통투자 재원,우려,자동수집(Claude),Y,
한전,언론기사,t3,"""전기요금 지역별 차등제, 지역 살리는 핵심 요소""",무등일보,도철원,2026-04-22,https://www.mdilbo.com/detail/DDAuq0/754993,송전망 건설비와 손실비용을 전국이 동일하게 부담하는 단일요금 구조가 수도권 집중을 심화한다며 지역별 차등 전기요금제 도입 필요성을 제기한다. 전력망을 도로·철도·항만급 국가기간시설로 보고 재원 구조를 재편해야 한다는 입장을 담았다.,"이제는 전력망을 도로, 철도, 항만과 같은 국가 기간시설 수준에서 바라봐야 한다",계통투자 재원,중립,자동수집(Claude),Y,
한전,보도자료,t2,(설명) 신규 송전선로 전체 지중화를 검토하고 있다는 내용은 사실이 아님,기후에너지환경부,,2026-06-22,https://www.korea.kr/policy/civilView.do?newsId=148966891,기후에너지환경부는 국가기간 전력망 건설 과정에서 주민 수용성 제고 방안을 검토 중이나 신규 송전선로 전체 지중화는 고려하지 않고 있다고 설명했다. 전면 지중화 시 막대한 건설비용으로 상당한 전기요금 상승이 불가피하다는 재원·요금 부담을 근거로 들었다.,신규 송전선로 전체 지중화시에는 막대한 건설비용으로 상당한 전기요금 상승이 불가피한 바,계통투자 재원,중립,자동수집(Claude),Y,
한전,보고서,t1,송전망 투자 재원 마련을 위한 지역별 전기요금 제도,국회입법조사처,,2024-10-08,https://nsp.nanet.go.kr/plan/subject/detail.do?nationalPlanControlNo=PLAN0000048869,"국회입법조사처가 2024년 10월 8일 발간한 자료로, 송전망 투자 재원 마련 수단으로서 변전소 위치에 따라 전기요금을 달리 정하는 지역별 전기요금 제도를 분석한다. 차등요금이 사업체의 합리적 입지 결정에 필요한 정보를 제공한다고 본다.",지역별 전기요금 제도는 행정구역이 아닌 변전소 위치에 따라 전기요금을 달리 정하는 것,계통투자 재원,중립,자동수집(Claude),Y,
한전,언론기사,t3,"기후부, 변압기·전선 등 주요 전력기자재 수급상황 점검",에너지데일리,송병훈,2026-05-26,http://www.energydaily.co.kr/news/articleView.html?idxno=167597,기후에너지환경부가 2026년 5월 26일 한전에서 변압기·전선 제작사와 수급상황 점검 간담회를 열었다. 전 세계 전력망 투자 확대와 중동 정세 불안에 대응해 기존 1년 단위 공급계획을 3개년 단위로 확대하고 중장기 수요를 반영한 선제 발주로 국내 공급을 안정화하기로 했다.,"이에 기존 1년 단위였던 공급계획을 3개년 단위로 확대했으며, 중장기 수요를 선제적으로 반영한 발주를 통해 국내 공급을 안정화 할 예정이다.",계통투자 재원,중립,자동수집(Claude),Y,
한전,보도자료,t2,"성공적인 에너지 전환의 핵심, 계통 거버넌스 개선 방향",기후솔루션,,2025-11-25,https://forourclimate.org/ko/newsroom/1167,한전이 송배전망 소유자이면서 규칙 제정자 역할을 겸해 재생에너지 확대에 구조적 인센티브가 부족하다고 지적한다. 영국 NESO·미국 ISO/RTO 사례를 들어 장기 송전망 계획·접속 관리 권한을 전력거래소로 이전하고 독립규제기관을 설립해 계통운영·규제의 독립성을 확보해야 한다고 제언한다.,장기 송전망 계획 수립 및 접속 관리 권한은 전력거래소로 이전,재생에너지·시장구조,우려,자동수집(Claude),Y,
한전,보도자료,t2,"[보도자료] 제주 사례 분석 결과, 최소발전용량 하향하면 재생에너지 출력제어 최대 70% 완화, 45억원 절감",기후솔루션,,2025-11-05,https://forourclimate.org/ko/newsroom/1152,"제주 사례 분석에서 최소발전용량을 국제 권고 수준까지 낮추면 재생에너지 출력제어를 최대 약 70%(2만4032MWh) 줄일 수 있는 것으로 나타났다. 이에 따라 온실가스 최소 3044톤~최대 1만1740톤, 연료비 최대 45억원 절감 효과가 분석됐다.",국제 권고 수준까지 낮추면 최대 약 70%(2만4032MWh)의 재생에너지 출력제어가 줄어드는 것으로 나타났다.,재생에너지·시장구조,우려,자동수집(Claude),Y,
한전,언론기사,t3,"울산시, 에너지 판 다시 쓰다… 분산에너지 특화지역 최종 지정",아시아경제,김철우,2025-12-25,https://view.asiae.co.kr/article/2025122515444833640,울산시가 기후에너지환경부 에너지위원회 재심의 결과 분산에너지 특화지역(전력수요 유치형)으로 최종 선정됐다. 지산지소형 전력 직거래 규제 특례가 적용돼 지역 생산 전기를 지역에서 소비하는 체계의 법적 기반이 마련됐다.,시가 기후에너지환경부 에너지위원회 재심의 결과 분산에너지 특화지역으로 최종 선정됐다.,재생에너지·시장구조,우호,자동수집(Claude),Y,
한전,언론기사,t3,호남권 2.3GW 계통 접속 재개 본격화…재생에너지 접속 '숨통',에너지데일리,변국영,2025-07-15,https://www.energydaily.co.kr/news/articleView.html?idxno=157962,"전력망 포화로 중단됐던 호남권 재생에너지 신규 계통 접속이 7월 15일부터 재개됐다. 허수사업자 회수 물량 0.4GW와 배전단 유연접속 1.9GW 등 총 2.3GW의 접속 가능 물량을 확보했으며, 유연접속은 송전망 혼잡 시 우선 출력제어를 받는 방식이다.","전력당국은 상반기 동안 호남권에서 ▲허수사업자 회수 물량 0.4GW, ▲배전단 유연접속 가능 물량 1.9GW 등 총 2.3GW의 접속 가능 물량을 확보했다.",재생에너지·시장구조,우호,자동수집(Claude),Y,
한전,언론기사,t3,"""규제 거버넌스 강화로 전력시장 투명성 높여야""",에너지신문,권준범,2024-10-22,https://www.energy-news.co.kr/news/articleView.html?idxno=206775,전력시장 개편 논의에서 시장 감시·규제 거버넌스 강화를 통한 투명성 제고 필요성이 제기됐다. 계통을 감시하는 독립적 규제 기구가 부재한 현 구조의 한계를 지적한다.,전력시장 감시와 규제 거버넌스의 강화를 통해 시장 투명성을 높여야 한다.,재생에너지·시장구조,우려,자동수집(Claude),Y,
한전,언론기사,t3,RE100 선언 기업의 고민…PPA '깜깜이' 망 이용료 손 본다,뉴시스,손차민,2026-05-05,https://www.newsis.com/view/NISX20260504_0003616758,"직접PPA에 나선 기업은 발전사업자에 전력량 요금을, 한전에 송배전망 이용 대가인 망 이용료를 낸다. 기업들이 재생에너지 조달 방식으로 직접PPA를 가장 선호(36.2%)하지만 불투명한 망 이용료 산정 기준이 걸림돌로 지적돼 제도 정비가 추진된다.",직접PPA에 나선 기업은 발전사업자에 양사 간 계약한 전력량 요금을 내면 된다. 여기에 한전에 송배전망을 이용하는 대가로 망 이용료를 낸다.,재생에너지·시장구조,중립,자동수집(Claude),Y,
한전,언론기사,t3,"(2026 신년기획) 첫발 뗀 분산특구, '지속가능 제도'로 안착할까",전기신문,김진후,2026-01-03,https://www.electimes.com/news/articleView.html?idxno=363628,1차 분산에너지 특화지역 지정이 마무리됐으나 제도 지향점과 성과 기준에 대한 논의가 여전히 진행형임을 짚는다. 투자 대비 수익 회수 경로가 불명확해 사업 지속가능성에 대한 우려가 제기된다.,"사업은 결국 투자 대비 수익 회수 가능성이 좌우하는데, 지금 특구 설계에서는 그 경로가 희미하다.",재생에너지·시장구조,우려,자동수집(Claude),Y,
한전,언론기사,t3,[2026 이렇게 달라진다] 전력·원자력·분산에너지 분야,투데이에너지,,2026-01-13,https://www.todayenergy.kr/news/articleView.html?idxno=293072,"2026년 3월 봄·가을 출력감소 조건으로 보상받는 '재생에너지 준중앙제도'가 도입된다. 분산에너지 특구를 지정해 전력계통영향평가 간소화, 분산편익 인센티브, 전력 직접거래 허용 등의 혜택을 부여한다.",재생에너지의 전력망 시장 수용성 제고를 위해 봄·가을 출력감소 조건으로 보상받는 '재생에너지 준중앙제도'를 올해 3월 도입,재생에너지·시장구조,중립,자동수집(Claude),Y,
한전,언론기사,t3,"호남의 재생에너지 계통제약, '배전망 ESS'로 해소해 나간다",부산일보,송현수,2026-07-10,https://www.busan.com/view/busan/view.php?code=2026071015274442328,국내 최초로 배전망 ESS를 활용해 호남 재생에너지 계통제약을 해소하는 사업이 추진된다. 2030년까지 ESS 약 700MW를 보급해 재생에너지 1GW를 추가 접속할 계획이다.,2030년까지 ESS 약 700MW를 보급해 재생에너지 1GW를 추가 접속할 계획이다.,재생에너지·시장구조,우호,자동수집(Claude),Y,
한전,보고서,t1,기업 경쟁력 강화를 위한 산업용 전기요금 부담 완화방안,한국경영자총협회,,2025-04-07,https://eiec.kdi.re.kr/policy/domesticView.do?ac=0000193772,"한경총은 전력수요 증가 대응을 위한 요금 인상 필요성은 인정하면서도, 2021년 이후의 인상이 산업용에 과도하게 집중돼 기업 생산·투자를 위축시킬 우려가 크다고 지적한다. 산업용 요금 부담 완화 방안을 제안하는 재계 입장 자료다.","다만, 현재까지의 전기요금 인상은 산업용 전기요금에만 과도하게 집중되었고 이러한 추세가 지속될 경우 우리 기업의 생산·투자활동을 위축시킬 우려가 매우 큼.",요금 정상화,우려,자동수집(Claude),Y,KDI 경제정보센터 게재
한전,보고서,t1,산업계 전력수요 대응을 위한 전력공급 최적화 방안,대한상공회의소,,2024-11-25,https://eiec.kdi.re.kr/policy/domesticView.do?ac=0000189944,최대 전력수요가 2003년 47GW에서 2023년 94GW로 98% 늘고 발전설비는 154% 증가했으나 송전설비는 같은 기간 26% 증가에 그쳤다고 진단한다. 송전망 적기 확충을 위한 국가적 지원체계 마련이 시급하다는 입장이다.,발전설비 용량과 전력수요가 늘어나면 송전설비(회선길이)도 비례적으로 늘어나야 함.,계통투자 재원,우려,자동수집(Claude),Y,KDI 경제정보센터 게재
한전,보고서,t1,AI 혁명에 부응한 선제적 전력공급·전력망 확충 긴요 (이슈와 논점 2238호),국회입법조사처,유재국,2024-05-21,https://www.nars.go.kr/report/view.do?cmsCode=CM0018&brdSeq=44746,"AI 데이터센터가 기존 데이터센터의 6배 전력을 소비해 대규모 전력설비 확충이 전제돼야 건설·운용이 가능하다고 진단한다. 선제적 전력공급·적정 전원구성 검토, 전력·통신망 비용 종합 고려, 운영 효율화 지원, 공동구 개발 활성화 등 4대 정책과제를 제시한다.",AI 데이터센터는 기존 데이터센터의 6배 전력(power)을 소비하기에 대규모 전력 설비를 확충해야 필요한 AI 데이터센터의 건설ㆍ운용이 가능하다.,수요·실적 전망,우려,자동수집(Claude),Y,
한전,보고서,t1,AI 시대 데이터센터 증가의 국내 에너지 소비 시사점 (기본연구 25-09),에너지경제연구원,김철현·김성균,2026-05-21,https://eiec.kdi.re.kr/policy/domesticView.do?ac=0000205158,주요국 중심으로 AI 데이터센터 에너지 소비 연구가 활발한 반면 국내 데이터센터 에너지 소비 연구·정책은 미흡하다는 문제의식에서 출발한 KEEI 기본연구다. AI 서버는 냉각·전력 한계로 랙당 4~10대만 장착되는 등 전력밀도 특성을 분석했다.,"주요국을 중심으로 AI 시대 데이터센터의 에너지 소비 연구가 활발하게 이뤄지고 있으나, 국내 데이터센터의 에너지 소비 관련 연구는 없음",수요·실적 전망,중립,자동수집(Claude),Y,KDI 경제정보센터 게재·자료등록일 기준(보고서번호 25-09)
한전,보고서,t1,재생에너지 공급확대를 위한 중장기 발전단가(LCOE) 전망 시스템 구축(5/5) (기본연구 24-22),에너지경제연구원,이근대·임덕오,2025-05-14,https://eiec.kdi.re.kr/policy/domesticView.do?ac=0000194859,태양광·풍력 설비비용 조사와 격자단위 지역별 LCOE 추정을 통해 재생에너지 확대에 따른 전력망 보강비용까지 반영한 발전단가 전망을 제시한다. 우수입지 확보·사업모델 다양화·규제 완화 등 LCOE 인하 방안을 권고한다.,지속적인 재생에너지 보급 확대를 위해서는 경제적 측면에서 현재의 문제점을 짚어보고 향후 재생에너지 LCOE를 낮추기 위한 개선 방안이 필요함.,재생에너지·시장구조,중립,자동수집(Claude),Y,KDI 경제정보센터 게재
한전,보고서,t1,"에너지 전환과 안보, 산업경쟁력 강화를 위한 전력 정책과제 제안",국회미래연구원,,2025-10-13,https://eiec.kdi.re.kr/policy/domesticView.do?ac=0000198939,에너지 수입의존도 90% 이상인 한국에서 전력 중심 에너지 안보가 산업경쟁력의 핵심이 됐다는 문제의식으로 전력 정책과제를 제안한다. 청정에너지 전환·산업재편 가속기에 대응하는 전략적 대비를 촉구한다.,"에너지 안보는 단순한 에너지 공급의 문제가 아니라, 경제 성장과 산업경쟁력, 국가 안보, 그리고 외교 전략을 좌우하는 핵심 의제로 부상하고 있음",계통투자 재원,우려,자동수집(Claude),Y,KDI 경제정보센터 게재
한전,보고서,t1,"재생에너지 전환 시대, SMR의 전략적 역할",KDB미래전략연구소,,2025-08-29,https://eiec.kdi.re.kr/policy/domesticView.do?ac=0000197732,SMR이 입지 분산성 덕분에 재생에너지 송전망 확충 부담을 완화하고 무탄소 부하추종 전원으로 전력계통 유연성 확보에 기여한다고 분석한다. 재생에너지와 상호보완적 전원으로 병행 추진할 것을 제언한다.,"SMR은 입지 분산이 가능해 재생에너지의 송전망 확충 부담을 완화하며, 무탄소 부하추종 전원으로 전력계통의 유연성 확보에 기여함.",재생에너지·시장구조,중립,자동수집(Claude),Y,KDI 경제정보센터 게재
