persona,source_type,tier,title,org,author,date,url,summary,excerpt,priority_axis,stance_signal,collector,verified,note
한전,언론기사,t3,"[이슈분석] 한전 73조 송전망 투자, 발전원별 명암 갈린다",에너지경제신문,전지성,2025-05-28,https://m.ekn.kr/view.php?key=20250528026241222,한전의 73조원 송전망 투자 계획이 재생에너지·원전 등 발전원별로 미치는 상반된 영향을 이슈 분석.,"국내 원전은 대부분 경상도와 전라도 등 남부 지역에 집중되어 있어, 수도권까지 전력을 송전하는 데 물리적 한계가 존재했다.",계통투자 재원,중립,자동수집(Claude),Y,
한전,보도자료,t2,"한전, 『제11차 장기 송변전설비계획』 수립·발표",한국전력공사,곽중근,2025-05-27,http://www.digitalbizon.com/news/articleView.html?idxno=2340012,"제11차 장기 송·변전설비계획 확정(2024~2038, 72.8조원) — 서해안 HVDC 등 재생에너지 계통연계와 첨단산업 전력공급 인프라 확충.","송변전설비는 안정적 전력공급을 위한 필수설비인 만큼, 한전은 설비투자를 최우선 순위로 두고 차질없이 확충·보강해 나갈 계획이다.",계통투자 재원,중립,자동수집(Claude),Y,
한전,언론기사,t3,꽉 막힌 호남 송전망 숨통 트나‥한전 송변전 72조 투입,남도일보,안세훈,2025-05-27,https://www.namdonews.com/news/articleView.html?idxno=821305,"제11차 장기송변전설비계획으로 호남~수도권 HVDC를 4GW급 2루트에서 2GW급 4루트로 재편하고 2038년까지 72.8조원(16.3조 증액)을 투입, 생산유발 134조·고용 48만명 효과를 전망.",한전은 이번 계획을 위해 2038년까지 72조8천억 원을 투자할 계획이다.,계통투자 재원,중립,자동수집(Claude),Y,
한전,언론기사,t3,"분산에너지 시대 열리나…정부, 분산특구 '파격 혜택'",전기저널,박경민,2025-05-21,https://www.keaj.kr/news/articleView.html?idxno=5869,정부가 분산에너지 특화지역에 직접거래 전기요금 인하·계통영향평가 면제 등 인센티브를 부여해 지산지소형 전력체계 전환을 추진한다는 내용.,분산특구는 크게 ▲수요유치형 ▲공급유치형 ▲신산업 활성화형 등 3가지 유형으로 나뉜다.,재생에너지·시장구조,중립,자동수집(Claude),Y,
한전,보고서,t1,친환경 설비 및 도매가격 변동성 확대 대응을 위한 전력시장 개편 방향 연구,에너지경제연구원(KEEI),이유수,2025-04-30,https://keei.re.kr/board.es?act=view&bid=0001&cg_code=C01&list_no=125589&mid=a10101020000,재생에너지 확대에 따른 도매가격 변동성에 대응해 계약시장 다양화·계절별/시간별 차등요금·가격 정상화 등 전력시장 개편 방향을 제시한 연구보고서.,도매 시장가격의 변동성이 심해질 가능성을 확인하였으므로 전력시장 개편 방향은 가격의 안정성을 확보하는 데 중점을 둘 필요가 있음.,재생에너지·시장구조,중립,자동수집(Claude),Y,
한전,보도자료,t2,"[보도자료] 한전, 재생에너지 차별 접속 제도 공정위에 신고돼",기후솔루션(SFOC),이근옥 변호사(기후솔루션),2025-04-24,https://forourclimate.org/ko/newsroom/1073,태양광 사업자 협회와 기후솔루션이 한전의 '출력제어 조건부 접속제도'를 망 독점을 이용한 시장지배적지위 남용으로 공정위에 신고한 사실을 다룬 보도자료.,한전은 공공재인 전력망을 독점하면서 재생에너지 사업자들에게만 전력망 접속 기준을 부당하게 차별하여 재생에너지 사업을 고사시키고 있다.,재생에너지·시장구조,우려,자동수집(Claude),Y,
한전,보고서,t1,제11차 전력수급 기본계획 주요 내용,에너지경제연구원(KEEI),,2025-04-22,https://kesis.keei.re.kr/board.es?mid=a10306000000&bid=0060&list_no=2125&act=view,"국책연구기관이 11차 전기본을 기준수요 전망·수요관리·전원믹스·전력시장 개편 관점에서 분석한 자료로, 발전설비 변화 및 전력시장 개편방향 도표를 포함.","2025년 2월, 산업통상자원부는 『제11차 전력수급기본계획(2024~2038)』을 확정하고 공고하였다.",수요·실적 전망,중립,자동수집(Claude),Y,발행일은 페이지 게시일 기준
한전,보고서,t1,한국전력공사 KIS Credit Opinion (신용평가),한국신용평가,이상은 선임애널리스트(한국신용평가),2025-03-28,https://m.kisrating.com/fileDown.do?menuCd=R8&gubun=2&fileName=rs20250331-5.pdf,대규모 부채에도 전력산업의 필수성·정부 지원수단 등을 근거로 한전의 원리금 상환가능성을 최고 수준으로 평가한 신용평가 의견.,"연료가격 안정화 등으로 수익성이 회복세를 보이고 있다. 전력산업 내 절대적인 사업지위를 보유하고 있으며, 수요기반이 안정적이다.",재무 건전성,우호,자동수집(Claude),Y,KIS Credit Opinion PDF(pdftotext 추출)·평가일 2025.03.28
한전,언론기사,t3,"한전, 작년 별도기준 영업익 3.2조…'고강도 자구노력 결과'",뉴시스,,2025-02-28,https://www.newsis.com/view/NISX20250228_0003082621,"한전이 2024년 별도기준 영업이익 3조1,749억원(전년비 148.8%↑)을 기록했으며, 구입전력비 절감 등 3조7,000억원 규모의 자구노력이 흑자전환의 핵심이었다고 설명.","한전은 28일 별도재무제표 기준으로 매출 91조6606억원, 영업이익 3조1749억원을 기록했다고 공시했다.",재무 건전성,우호,자동수집(Claude),Y,
한전,언론기사,t3,[에너지토피아] 종적 감춘 전기요금 원가주의 원칙,아시아경제,강희종(추경호 발언 인용),2024-10-25,https://www.asiae.co.kr/article/2024102415242793611,원가주의 원칙이 서민부담을 이유로 산업용만 평균 9.7% 인상하면서 무너졌다는 비판 칼럼. 산업용이 고객의 1.7%에 불과하나 사용량의 53.2%를 차지하는 구조를 지적.,전기요금은 최종적으로 당에서 판단할 부분이다.,요금 정상화,우려,자동수집(Claude),Y,신문 오피니언 칼럼
한전,언론기사,t3,2026년부터 '지역별 차등 전기요금제' 시행,서울경제,,2024-05-23,https://www.sedaily.com/NewsView/2D9ASAW4XW,산업부가 2025년 도매요금→2026년 소매요금으로 지역별 차등요금제를 단계 도입하기로 확정. 김동철 한전 사장은 '궁극적으로 가야 할 길'이라며 도매(LMP) 단계부터의 차등 필요성을 언급.,산업통상자원부가 '지역별 차등 전기요금제' 시행 시기를 못박았다.,요금 정상화,중립,자동수집(Claude),Y,
한전,언론기사,t3,SMP·전기요금 지역별 차등화 추진,일렉트릭파워(EPJ),박윤석,2024-05-23,https://www.epj.co.kr/news/articleView.html?idxno=34346,전국 단일 SMP를 2025년 상반기부터 지역별로 차등화하고 2026년 소매 전기요금도 지역 차등제를 도입해 발전설비의 지역 분산을 유도한다는 정부 계획.,정부가 현재 전국 단일 가격으로 정산하고 있는 SMP(전력도매가격)을 2025년 상반기부터 지역별로 차등화하기로 했다.,요금 정상화,중립,자동수집(Claude),Y,
한전,언론기사,t3,태양광 출력제어 결국 육지까지 상륙…업계 추산 시간당 400MWh 규모,전기신문,,2024-04-09,https://www.electimes.com/news/articleView.html?idxno=335254,"2024년 4월 7일 전남 태양광에 시장 출범 이래 첫 내륙 대규모 출력제어가 시행됐고, 당시 태양광 비중 37.2%·시간당 약 400MWh 손실로 추정.","9일 관련 업계에 따르면 전력거래소와 한전 광주전남본부는 지난 7일 전남 일대(해남, 고흥 등) 태양광발전소를 대상으로 사상 첫 출력제어에 돌입했다.",재생에너지·시장구조,우려,자동수집(Claude),Y,
한전,언론기사,t3,"한전, 1분기 영업이익 3조7842억…전년비 0.8% 증가",뉴스핌,,2026-05-13,https://www.newspim.com/news/view/20260513001039,"한전은 2026년 1분기 연결 기준 매출 24조3985억원, 영업이익 3조7842억원(전년비 0.8% 증가)을 기록해 흑자를 이어갔다. 다만 부채 206조원, 차입금 128조원이 남아 하루 이자비용만 114억원을 부담하는 재무 구조가 지속되고 있다.","206조원의 부채와 128조원에 달하는 차입금이 남아 있어, 하루 이자비용으로만 114억원을 부담하고 있는 실정이다",재무 건전성,중립,자동수집(Claude),Y,
한전,언론기사,t3,"한전, 2025년 영업이익 13.5조… '에너지 보릿고개' 넘었지만 부채 206조 여전",데일리비즈온,,2026-02-26,https://www.dailybizon.com/news/articleView.html?idxno=63479,"한전은 2025년 연결 기준 영업이익 13조5248억원(전년비 61.7% 증가)으로 창사 이래 최대 실적을 냈으나, 총부채는 206조원, 차입금 130조원 규모로 여전히 역대 최대다. 하루 이자비용이 119억원에 육박해 영업이익 상당 부분이 원리금 상환에 투입되는 구조가 지적됐다.","현재 누적 부채는 206조 원, 차입금은 130조 원 규모에 달한다. 매일 지불해야 하는 이자 비용만 119억 원에 육박해, 영업이익의 상당 부분이 원리금 상환에 투입되는 실정이다.",재무 건전성,우려,자동수집(Claude),Y,
한전,언론기사,t3,전력공기업 성적표 보니⋯한전ㆍ한수원ㆍ남동발전ㆍ남부발전 'A등급' 유지 [2026 공공기관 경평],이투데이,,2026-06-19,https://www.etoday.co.kr/news/view/2595446,2025년도 공공기관 경영실적 평가에서 한전은 탁월(S) 다음으로 높은 우수(A) 등급을 지난해에 이어 유지했다. 에너지 가격 안정과 요금 인상 효과로 개선된 재무 실적이 A등급 유지의 배경으로 작용했다.,한전과 원전 운영을 담당하는 한수원은 지난해에 이어 올해 평가에서도 탁월(S) 등급 다음으로 높은 우수(A) 등급을 유지했다.,재무 건전성,우호,자동수집(Claude),Y,
한전,언론기사,t3,[2025년도 경평]희비 갈린 에너지公·자원公…한전 'A'·석유공사 'D',아시아경제,,2026-06-20,https://www.asiae.co.kr/article/2026062010255557771,"한전은 2022년도 경평에서 당기순손실로 미흡(D) 등급을 받았으나 누적 적자 폭 개선으로 2023년도 양호(B)로 올라섰고, 2025년도 실적(매출 97조4345억원·영업이익 13조5248억원)을 바탕으로 우수(A) 등급을 받았다. 석유공사·광해광업공단이 미흡(D)을 받은 것과 대비된다.","한전은 지난해 연결기준 실적으로 매출액 97조4345억원, 영업이익 13조5248억원을 기록했다.",재무 건전성,우호,자동수집(Claude),Y,
한전,언론기사,t3,"한전, 1분기 영업이익 3.78조···흑자 유지에도 재무 부담 여전",이뉴스투데이,,2026-05-14,http://www.enewstoday.co.kr/news/articleView.html?idxno=2429178,"한전은 2026년 1분기 영업이익 3.78조원으로 흑자를 유지했으나 부채 206조원, 차입금 128조원, 하루 이자비용 114억원의 재무 부담이 여전하다. 향후 연료비 상승 영향까지 겹쳐 재무 부담이 큰 것으로 진단됐다.",한국전력이 2026년 1분기 흑자를 이어갔지만 막대한 부채와 향후 연료비 상승 영향으로 재무 부담은 여전히 큰 것으로 나타났다.,재무 건전성,우려,자동수집(Claude),Y,
한전,언론기사,t3,"[실적 후] 한전, 1분기 최대 실적에도 유가·환율 부담에 목표가 하향 이어져",인포스탁데일리,,2026-05-14,https://www.infostockdaily.co.kr/news/articleView.html?idxno=215851,"한전은 2026년 1분기 매출 24조3985억원, 영업이익 3조7842억원(전년비 306억원 증가)의 최대 실적을 냈다. 그러나 2월 말 중동 전쟁발 국제 유가·LNG 급등이 아직 반영되지 않아 향후 시차를 두고 실적과 자금 조달에 부담으로 작용할 전망이며 증권가 목표가 하향이 이어졌다.",2월말 중동 전쟁에 따른 국제 유가 및 LNG 가격 급등세 여파가 1분기 실적에는 아직 반영되지 않은 결과로 향후 중동 전쟁 영향이 시차를 두고 실적 및 자금 조달에 영향을 줄 전망,재무 건전성,우려,자동수집(Claude),Y,
한전,언론기사,t3,"한국전력, 종전 임박에 조정 마무리 수순…목표가 24%↑",머니투데이,,2026-06-16,https://www.mt.co.kr/stock/2026/06/16/2026061608320819936,증권가는 중동전쟁 종전 국면 진입에 따른 투자 모멘텀과 가치 복원을 반영해 한전 목표주가를 기존 5만원에서 6만2000원으로 24% 상향하고 매수 의견을 유지했다. 종전으로 전쟁 이전의 투자모멘텀 부활과 가파른 가치 복원이 기대된다는 분석이다.,목표주가를 기존 5만원에서 6만2000원으로 24% 상향 조정하고 Buy(매수) 의견을 유지한다,재무 건전성,우호,자동수집(Claude),Y,
한전,보도자료,t2,"한전, 2026년 1분기 결산 실적 발표",한국전력공사,,2026-05-13,https://www.newswire.co.kr/newsRead.php?no=1034370,"한전은 2026년 1분기 매출 24.4조원(0.7% 증가), 영업이익 3.8조원(0.8% 증가)을 공시했다. 재정 건전화 노력으로 2023년 기준 47.8조원에 달했던 누적 영업적자를 올해 1분기 34.0조원으로 줄였다고 밝혔다.",2023년 기준 47.8조원에 달했던 누적 영업 적자는 올해 1분기 34.0조원으로 감소,재무 건전성,우호,자동수집(Claude),Y,
한전,보고서,t1,특수채 발행 확대가 채권시장에 미치는 영향: 한전채 발행 급증 사례를 중심으로,자본시장연구원,정화영,2024-07-24,https://www.kcmi.re.kr/report/report_view?report_no=1794,자본시장연구원이 2022년 이후 한전채 발행 급증 사례를 분석해 특수채가 신용물 투자수요를 흡수하며 민간채권을 구축하는 효과를 실증했다. 발행규모가 지나치게 커지면 채권시장 전반 금리 상승압력이 높아지므로 관리·제도개선이 필요하다고 제언한다.,한전채가 신용물에 대한 투자수요를 흡수하면서 상대적으로 신용등급이 열위에 있는 민간채권에 대한 투자수요를 구축하였음을 보여주고 있다.,사채발행한도,중립,자동수집(Claude),Y,
한전,언론기사,t3,"한전, 80조원 채권 폭탄되나…2027년까지 50조원 줄여야",에너지경제신문,전지성,2025-03-11,https://www.ekn.kr/view.php?key=20250311028394774,"2025년 한전 채권 발행 한도는 자본총계 17조5100억원의 5배인 약 87조5500억원인데, 사채발행한도 5배 특례가 2027년 일몰된다. 이에 따라 한전은 2027년 말까지 채권발행 잔액을 자본총계 2배인 35조200억원으로 낮춰야 하는 부담을 안는다.",이 조치는 2027년에 일몰된다. 이에 따라 한전은 2027년 말까지 채권발행 잔액을 35조200억원으로 낮춰야 한다.,사채발행한도,우려,자동수집(Claude),Y,
한전,언론기사,t3,"채권 발행해 적자 메우는 한전… 빚내 전력망 투자할 위기 [계획은 있지만, 전기가 없다 (中)]",파이낸셜뉴스,이유범,2025-08-04,https://www.fnnews.com/news/202508041827477290,"한전이 누적 적자 보전을 위해 75조원 규모의 한전채를 발행했고, 현행 발행 한도 90조5000억원 중 남은 여력은 15조5000억원에 불과하다. 전력망 투자 재원까지 채권에 의존해야 하는 구조적 위기를 지적한다.","현재 기준 한전채의 발행 한도는 총 90조5000억원이며, 이 중 앞으로 발생 가능한 여력은 15조5000억원에 불과하다.",사채발행한도,우려,자동수집(Claude),Y,
한전,언론기사,t3,"한전, 상반기 5조 흑자에도 부채 206조…채권 발행 한도 2028년부터 축소 부담",스페셜경제,박정우,2025-08-13,https://www.speconomy.com/news/articleView.html?idxno=404608,"한전이 2025년 상반기 5조원대 흑자에도 총부채가 206조원에 달하며, 사채발행한도 5배 특례 일몰로 2028년부터 한도가 2배로 축소돼 추가 발행이 어려워질 수 있다고 짚는다. 현 수준의 순발행이 이어지면 2028년 한도 초과 가능성이 있다고 경고한다.",현 수준의 채권 순발행이 이어질 경우 2028년에는 발행 한도를 초과할 가능성이 있다,사채발행한도,우려,자동수집(Claude),Y,
한전,언론기사,t3,한전채 3년물 4%대 돌파…채권시장 '자금경색' 경고등,아시아경제,이동우,2026-05-20,https://www.asiae.co.kr/article/2026052008283845091,2026년 5월 한전채 3년물 금리가 연 4%대를 약 2년 5개월 만에 다시 돌파하며 회사채 시장 구축효과 재현 우려가 부각됐다. 초우량 특수채인 한전채 금리 상승이 신용등급 낮은 회사채·여전채의 조달 여건을 압박한다고 분석한다.,한전채 금리가 오르면 상대적으로 신용등급이 낮은 일반 회사채나 여신전문금융회사채(여전채) 등은 투자 수요 확보를 위해 더 높은 금리를 제시해야 한다.,사채발행한도,우려,자동수집(Claude),Y,
한전,언론기사,t3,"기후부 용역 맡은 삼일회계법인 ""전력 공기업 최적 구조조정 방안은 한전 5개 발전자회사 하나로 통합""",경향신문,손우성,2026-06-18,https://www.khan.co.kr/article/202606182016025,기후에너지환경부 용역을 맡은 삼일회계법인이 남동·중부·서부·남부·동서발전 5개사를 하나의 법인으로 통합하는 안을 최적 구조조정 방안으로 권고했다. 단일 책임주체가 고위험 에너지 전환 과제를 일관되게 추진할 수 있다는 근거를 제시했다.,기후부 의뢰로 연구용역을 진행하고 있는 삼일회계법인은 가장 적합한 전력 공기업 구조조정 방안으로 한국남동발전·한국중부발전·한국서부발전·한국남부발전·한국동서발전 등 5개사의 통합을 권고했다.,사채발행한도,중립,자동수집(Claude),Y,
한전,언론기사,t3,"""발전5사 하나로 묶는다""…기후부, 내달 구조조정안 수립",전자신문,이준희,2026-06-18,https://www.etnews.com/20260618000162,기후에너지환경부가 발전공기업 5개사를 하나의 통합 법인으로 재편하는 안을 유력 구조개편안으로 부상시켰다. 1사 통합을 최적 대안으로 제시한 연구용역 중간결과를 토대로 다음 달 기능 재편·구조조정 방안을 수립한다는 일정을 밝혔다.,한국남동발전·중부발전·서부발전·남부발전·동서발전 등 발전공기업 5개사를 하나의 통합 법인으로 재편하는 방안이 정부의 유력한 구조개편안으로 부상했다.,사채발행한도,중립,자동수집(Claude),Y,
한전,언론기사,t3,'한 지붕' 모이는 발전 5사…임금·노조·본사 재편 숙제,머니투데이,강영훈,2026-07-18,https://www.mt.co.kr/economy/2026/07/18/2026071616361288719,"발전공기업 5사 통합이 가시화되면서 임금체계·복리후생 정비, 1만명 규모 노조 체계 재편, 통합 본사 위치 선정 등 후속 과제를 조명한다. 통합 시 분산된 경영·지원 기능 효율화와 중복 비용 절감 기대를 함께 전한다.","기후에너지환경부가 발전공기업 통합 작업에 속도를 내고 있지만 임금체계와 복리후생 정비, 1만명 규모 노조 체계 재편, 통합 본사 위치 선정 등 풀어야 할 과제가 적지 않다.",사채발행한도,중립,자동수집(Claude),Y,
한전,언론기사,t3,"한전, 3분기 전기료 동결 결정…전기요금 인상은 언제쯤?",뉴시스,김동현,2026-06-22,https://www.newsis.com/view/NISX20260622_0003677735,"한전이 2026년 3분기(7~9월) 연료비조정단가를 kWh당 +5원으로 유지해 연료비조정단가 기준 2022년 3분기 이후 17개 분기 연속, 일반용 전기요금은 13개 분기 연속 동결됐다. 실적연료비(469.03원/kg)가 기준연료비(494.63원/kg)보다 낮아 필요 조정단가는 -3.4원/kWh 수준으로 원가상 인하요인이 있었음에도 상한이 유지됐다.","연료비조정단가는 2022년 3분기 이후 17개 분기 연속, 일반용 전기요금은 13개 분기 연속 동결됐다 / 필요 조정단가는 -3.4원/㎾h 수준이다",요금 정상화,중립,자동수집(Claude),Y,
한전,언론기사,t3,전기요금 결정 '독립성' 강화 추진… 한국전력감독원 신설 법안 발의,에너지데일리,송병훈,2026-06-29,https://www.energydaily.co.kr/news/articleView.html?idxno=200911,"전기요금 결정의 독립성·객관성 부족 문제를 배경으로, 전기위원회 심의·의결에 법적 구속력을 부여하고 별도 독립기관인 한국전력감독원을 신설하는 전기사업법 개정안이 2026년 6월 발의됐다. 개정안 핵심은 전력시장·전력계통 운영 전반을 감독하는 전력감독원 설립이다.","전기요금 결정 과정의 독립성과 객관성이 부족하고, 전력시장 변화에 대한 전문적·중립적 의사결정 체계가 미흡하다는 지적이 꾸준히 제기돼 왔다.",요금 정상화,우호,자동수집(Claude),Y,
한전,언론기사,t3,대통령 공약 '독립 규제기관 설립' 실현 가능성은…,전기신문,김부미,2023-11-05,https://www.electimes.com/news/articleView.html?idxno=328280,"전기요금이 재무적 근거보다 정책적·정치적 판단으로 결정돼 원가보다 낮게 형성되고 시장 왜곡을 낳는다는 문제의식 아래, 전력산업계의 '전기요금 탈정치화' 요구와 독립 규제기관 설립 공약의 실현 가능성을 다룬다. 전기위원회가 산업부 내 심의기구에 불과한 한계를 지적한다.","현재 전기요금 결정은 국제 에너지가격을 반영하지 못하고 정책적, 정치적 결정에 의해 원가보다 낮게 형성되며 심각한 시장 왜곡을 불러일으키고 있다.",요금 정상화,우호,자동수집(Claude),Y,
한전,보고서,t1,에너지 전환을 위한 전력산업 규제체계 중립성∙전문성 확보 방안,기후솔루션,,2026-04-21,https://forourclimate.org/ko/research/658,"현행 규제체계가 이해상충을 가진 한전·전력거래소와 이에 의존하는 기후부 중심으로 운영된다고 진단하고, 전기위원회를 합의제 최고 감독기관으로 격상하고 전력감독원을 신설해 조사·검사·제재 기능을 전담시킬 것을 2026년 4월 제안했다.","전기위원회를 전력산업 전반의 최종 의사결정을 수행하는 합의제 최고 감독기관으로 격상, 전력감독원 신설하여 조사∙검사∙제재 기능 전담",요금 정상화,우호,자동수집(Claude),Y,
한전,언론기사,t3,[초점] 전력 규제 거버넌스 개편 방향 주목,투데이에너지,이종수,2025-11-25,https://www.todayenergy.kr/news/articleView.html?idxno=291431,"전력시장·계통·전기요금 등 정책결정 구조의 독립성·중립성 부족을 배경으로, 전기위원회를 독립 규제기구로 명시하고 원가주의·시장안정·재생에너지 통합을 원칙으로 하는 요금체계 설계 방향을 다룬다. 전력감독원은 100명 규모로 추진되고 있다.","원가주의, 시장 안정, 재생에너지 통합을 원칙으로 하는 요금 체계와 시장 규칙을 설계",요금 정상화,우호,자동수집(Claude),Y,
한전,언론기사,t3,"주택용 전기요금, 내년도 동결로 시작할까…전기위 개편·산업계 부담 등 변수",쿠키뉴스,김재민,2025-12-04,https://v.daum.net/v/20251204060254026,"주택용·일반용 전기요금 동결 기조가 이어지는 가운데, 전력시장 변화로 전기요금 결정이 정부로부터 독립돼야 한다는 주장과 전기위원회 개편 논의를 2025년 12월 시점에서 정리했다. 연료비조정단가는 직전 3개월 유연탄·LNG 등 연료가격 변동을 반영한다.",연료비조정단가는 해당 분기 직전 3개월의 유연탄·액화천연가스(LNG) 등 연료 가격 변동을 반영해,요금 정상화,중립,자동수집(Claude),Y,
한전,언론기사,t3,"전기료 부담금 낮췄더니…전력기금, 내년부터 4.6조 빌린다[Pick코노미]",서울경제,이정훈,2026-06-09,https://www.sedaily.com/article/20053307,"전력산업기반기금 부담금 요율을 2024년 7월 3.2%, 2025년 7월 2.7%로 인하한 결과 기금 여유재원이 빠르게 소진돼 향후 2년간 공자기금에서 4조6000억 원을 차입하는 상황을 다룬다. 전기요금 고지서에 붙어 걷히는 부담금 인상이 요금 정상화 압박과 맞물려 어렵다는 점을 짚는다.",한전의 누적 재무 부담으로 전기요금 정상화 압박이 남아 있는 상황에서 전력기금 부담금까지 올리면 전기사용자 반발이 커질 수 있기 때문이다.,요금 정상화,중립,자동수집(Claude),Y,
